{"schema_version":"1.0","id":"f04-partial-repaired","pair_id":"f04-partial-response","variant":"repaired","seed":604,"workload":{"logical_requests":8,"operation":"status","tenants":["north","south"],"deadline_ms":100,"cleanup_reserve_ms":10,"arrival_interval_ms":0,"time_scale":0.1},"dependencies":[{"name":"unit","required":true,"latency_ms":10,"effectful":false},{"name":"road","required":true,"latency_ms":20,"effectful":false},{"name":"weather","required":false,"latency_ms":15,"effectful":false}],"fault":{"kind":"partial_response","retry_dependency":null,"retryable_failures_per_request":0,"missing_dependencies":["road"],"cancel_after_ms":null,"duplicate_requests":1,"conflicting_duplicate":false,"slow_dependency":null,"slow_latency_ms":null},"policy":{"propagate_deadline":true,"cancellation":true,"retry_owner":"caller","max_attempts":2,"retry_budget":4,"backoff_base_ms":5,"backoff_cap_ms":20,"full_jitter":true,"global_limit":24,"per_dependency_limit":{"unit":8,"road":8,"weather":8},"per_tenant_limit":12,"queue_limit":8,"queue_wait_ms":20,"deduplicate":true,"explicit_partial":true,"health_isolated":true}}
